question_id,question,option_a,option_b,option_c,option_d,correct_answer,explanation
1,"What is a foundry?","An establishment where metal objects are produced by melting metal and pouring into moulds","A workshop for machining only","A plant for rolling steel","A warehouse for storing steel","A","A foundry produces metal objects by pouring molten metal into moulds."
2,"Casting is primarily a:","Metal forming method","Heat treatment process","Surface finishing process","Inspection method","A","Casting is one of the fundamental metal forming methods."
3,"Why do integrated steel plants maintain captive foundries?","To produce castings required within the plant","To manufacture electrical equipment","To generate electricity","To refine crude oil","A","Captive foundries supply various cast components required by steel plants."
4,"Which of the following is a foundry product?","Ingot mould","Cooling tower","Air compressor","Conveyor belt","A","Ingot moulds are common foundry products."
5,"Which of the following is NOT listed as a foundry product?","Bottom plate","Pig mould","Trumpet","Blast furnace shell","D","Blast furnace shell is not listed among foundry products."
6,"The centralized repair shop in SAIL plants mainly performs:","Production of spares and repair/reconditioning","Only electrical maintenance","Only civil maintenance","Only quality inspection","A","Repair shops manufacture spares and repair equipment."
7,"Efficient operation of an integrated steel plant depends greatly on:","Proper upkeep of installed equipment","High electricity tariff","Export policy","Weather conditions","A","Equipment maintenance is essential for uninterrupted production."
8,"Scientific maintenance requires:","Right spares of right quality, quantity and time","Only imported spares","Only local vendors","No spare inventory","A","Proper maintenance depends on correct spare availability."
9,"Non-availability of spares may result in:","Postponement of preventive maintenance","Increase in production","Reduction in downtime","Higher product quality","A","Maintenance activities get delayed when spares are unavailable."
10,"Modular replacement of assemblies mainly helps to:","Reduce downtime","Increase fuel consumption","Increase breakdowns","Reduce steel quality","A","Replacing complete modules minimizes repair time."
11,"Which shop is responsible for forging operations?","Forge Shop","Tool Room","Inspection Shop","Laboratory","A","Forge Shop performs forging operations."
12,"Which of the following is NOT a repair shop section?","Machine Shop","Forge Shop","Fabrication Shop","Sinter Plant","D","Sinter Plant is a production unit, not a repair shop."
13,"Welding is primarily a:","Material joining process","Metal extraction process","Heat treatment process","Casting process","A","Welding joins materials permanently."
14,"Oxyfuel gas welding uses heat from:","Gas flame","Electric arc","Laser beam","Resistance heater","A","Gas flame provides the heat."
15,"Arc welding obtains heat from:","AC or DC electrical source","Steam","Compressed air","Chemical reaction","A","Electrical arc produces the welding heat."
16,"Resistance welding produces heat because of:","Electrical resistance","Gas combustion","Solar radiation","Magnetic field","A","Current passing through resistance generates heat."
17,"Fabrication mainly involves:","Welding, forming and fitting","Casting and rolling","Mining and crushing","Heat treatment only","A","These are the basic fabrication operations."
18,"Fabrication shops mainly repair and manufacture:","Steel plant structures and equipment","Electrical cables","Chemical reagents","Refractory bricks","A","Fabrication shops handle structural work."
19,"Which machine is commonly available in a fabrication shop?","Profile cutting machine","Blast furnace","Converter","Rolling mill","A","Profile cutting machines are standard fabrication equipment."
20,"Forging is the process of shaping metal by:","Force with or without heat","Cooling only","Grinding","Casting","A","Forging applies force to deform metal."
21,"Plastic deformation in forging occurs when:","Stress exceeds yield stress","Stress is zero","Metal reaches melting point","Current flows","A","Yield stress must be exceeded for permanent deformation."
22,"Forge shops generally use:","Forging hammers and presses","Lathe only","Drilling machine only","Cooling tower","A","These are essential forging equipment."
23,"Fabrication means:","Joining together","Melting","Casting","Polishing","A","Fabrication refers to joining components."
24,"Before fabrication, materials are first:","Marked","Painted","Heat treated","Galvanized","A","Marking precedes cutting."
25,"After marking, fabrication materials are usually:","Cut to size","Packed","Inspected","Stored","A","Cutting follows marking."
26,"Structural fabrication is completed mainly by:","Riveting or welding","Casting","Annealing","Forging","A","Joining methods complete fabrication."
27,"Which crane is commonly used in fabrication shops?","EOT Crane","Tower Crane","Mobile Crane","Floating Crane","A","EOT cranes handle heavy materials."
28,"Machining removes material in the form of:","Chips","Powder","Gas","Liquid","A","Machining removes excess metal as chips."
29,"Turning is a:","Machining operation","Casting operation","Heat treatment","Inspection method","A","Turning is performed on lathes."
30,"Which is NOT a machining operation?","Drilling","Grinding","Rolling","Milling","C","Rolling is a metal forming process."
31,"Machine shops are mainly used for:","Finishing metal parts accurately","Making coke","Purifying oxygen","Water treatment","A","Machining achieves close dimensions."
32,"Which machine is commonly found in machine shops?","Lathe","Cooling tower","Blast furnace","Electrostatic precipitator","A","Lathes are essential machining tools."
33,"Balancing machines are used to:","Determine unbalance of rotating parts","Measure hardness","Test water quality","Inspect welds","A","Balancing prevents vibration."
34,"Balancing mass is added or removed to:","Balance rotating components","Increase weight","Reduce hardness","Improve corrosion resistance","A","Balancing reduces equipment failures."
35,"Electrical Repair Shop mainly repairs:","Electric motors","Blast furnaces","Cooling towers","Rail tracks","A","ERS specializes in electrical equipment."
36,"ERS also repairs:","Load lifting magnets","Blast furnace shell","Sinter machine","Cooling bed","A","Magnets are repaired in ERS."
37,"Motor overhauling includes:","Dismantling, cleaning, varnishing and testing","Painting only","Machining only","Heat treatment only","A","Complete overhaul restores motor condition."
38,"Burnt motors require replacement of:","Stator and rotor windings","Bearings only","Housing only","Couplings only","A","Damaged windings are repaired or replaced."
39,"Gas Utilities include:","Oxygen Plant","Rolling Mill","Blast Furnace","Foundry","A","Oxygen Plant is a utility department."
40,"The Oxygen Plant produces:","Oxygen, Nitrogen and Argon","Hydrogen only","Carbon dioxide","Acetylene only","A","These industrial gases are produced."
41,"Air Separation Units separate gases using:","Cryogenic distillation","Filtration","Electrolysis","Evaporation","A","Cryogenic distillation separates air components."
42,"Liquid oxygen purity is maintained above:","99.55%","95%","90%","85%","A","The chapter specifies purity above 99.55%."
43,"Nitrogen impurity is maintained below:","10 ppm","100 ppm","1000 ppm","1%","A","Very high purity nitrogen is produced."
44,"Liquid argon impurity is maintained below:","2 ppm","20 ppm","200 ppm","2%","A","Argon is maintained at very high purity."
45,"Moisture is removed from compressed air using:","Absorber bed","Cooling tower","Blast furnace","Boiler","A","Absorber beds remove moisture."
46,"Cooling required for gas separation is produced by:","Expansion turbine","Rolling mill","Converter","Heat furnace","A","Expansion turbines generate cooling."
47,"Liquid gases are stored in:","Cryogenic storage vessels","Water tanks","Coal bunkers","Coke ovens","A","Cryogenic vessels store liquefied gases."
48,"Buffer vessels are provided to:","Handle fluctuating demand","Increase impurity","Reduce purity","Store coal","A","Buffer vessels stabilize supply."
49,"Oxygen enrichment in blast furnaces helps to:","Reduce coking coal consumption","Increase ash","Reduce productivity","Increase slag only","A","Oxygen enrichment improves furnace efficiency."
50,"Oxygen enrichment increases:","PCI rate","Coal moisture","Sulphur","Dust","A","Higher PCI is possible with oxygen enrichment."
51,"Steel is produced in BOF by:","Blowing oxygen into hot metal","Adding nitrogen","Adding argon","Cooling iron","A","BOF converts hot metal into steel."
52,"Blowing oxygen into BOF mainly reduces:","Carbon percentage","Iron percentage","Silicon percentage","Copper percentage","A","Carbon removal produces steel."
53,"Liquid oxygen is also supplied for:","Medical purposes","Painting","Lubrication","Water treatment","A","Medical oxygen is supplied in cryogenic tankers."
54,"Nitrogen is mainly used because it is:","Inert","Combustible","Toxic","Explosive","A","Nitrogen provides an inert atmosphere."
55,"Nitrogen is used during PCI grinding to:","Maintain inert atmosphere","Increase combustion","Reduce pressure","Increase moisture","A","Inert conditions improve safety."
56,"Nitrogen is used for:","Purging explosive mixtures","Producing slag","Steel casting","Coal crushing","A","Purging prevents explosions."
57,"Argon is mainly used in:","Special steel production","Water treatment","Coal washing","Power generation","A","Argon provides inert protection."
58,"Argon maintains inert atmosphere in:","RHOB","Blast furnace top","Cooling tower","Foundry","A","RHOB uses argon."
59,"Acetylene is produced from:","Calcium carbide","Limestone","Iron ore","Dolomite","A","Calcium carbide is the raw material."
60,"Acetylene is mainly used for:","Slab cutting","Water treatment","Cooling","Power generation","A","Cutting torches use acetylene."
61,"Protective Gas contains:","95% nitrogen and 5% hydrogen","90% oxygen and 10% nitrogen","100% hydrogen","100% nitrogen","A","The mixture is specified in the chapter."
62,"Protective Gas Plant supplies gas for:","Annealing and galvanizing furnaces","Blast furnace","Coke oven","Foundry","A","Protective gas provides inert atmosphere."
63,"Industrial clean water is mainly used for:","Cooling equipment","Drinking","Sewage disposal","Rainwater collection","A","Clean water cools equipment."
64,"DM water is mainly supplied to:","Boilers and furnace cooling","Gardens","Road cleaning","Coal washing","A","DM water prevents scaling."
65,"Storm water management prevents:","Flooding of tunnels and cellars","Steel corrosion","Power failure","Gas leakage","A","Storm water disposal prevents flooding."
66,"RCL stands for:","Research and Control Laboratory","Rolling Control Laboratory","Research Casting Laboratory","Refractory Control Laboratory","A","RCL is the quality laboratory."
67,"Main function of RCL is:","Maintain and improve product quality","Generate power","Mine ore","Transport steel","A","Quality assurance is its core role."
68,"RCL has how many wings?","Five","Three","Four","Six","A","Five wings are listed."
69,"Which is NOT an RCL wing?","Metallurgical Testing","Chemical Testing","Mechanical Testing","Mining Testing","D","Mining Testing is not listed."
70,"Process control laboratories monitor:","Yield and production parameters","Employee attendance","Sales revenue","Transport schedule","A","They monitor production quality."
71,"Digital pyrometers measure:","Temperature","Pressure","Hardness","Density","A","Pyrometers measure temperature."
72,"ONH analyzer measures:","Oxygen, Nitrogen and Hydrogen","Carbon only","Sulphur only","Phosphorus only","A","ONH analyzer measures dissolved gases."
73,"Inspection wing mainly separates:","Good products from defective ones","Iron from steel","Coal from coke","Gas from air","A","Inspection classifies products."
74,"Inspection also checks:","Embossing and packaging","Payroll","Recruitment","Security","A","Packaging inspection ensures safe delivery."
75,"NABL accreditation has been obtained by:","DSP and BSP","All SAIL plants","Only RSP","Only ISP","A","DSP and BSP are accredited."
76,"Refractories are vital because they influence:","Production, productivity and economics","Employee salaries","Transport cost only","Marketing","A","Refractory quality directly affects plant performance."
77,"Steel industry consumes approximately:","60–70% of refractories","10–20%","30–40%","90–100%","A","Steel plants are the largest consumers."
78,"RED stands for:","Refractory Engineering Department","Rolling Engineering Department","Research Engineering Division","Railway Engineering Department","A","RED manages refractory maintenance."
79,"RED is responsible for:","Maintenance of refractory-lined units","Water treatment","Power generation","Coal mining","A","RED handles refractory maintenance."
80,"RMP mainly handles:","Limestone","Iron ore","Coal","Scrap","A","RMP processes limestone."
81,"Limestone is burnt in kilns to produce:","Lime","Coke","Pig iron","Steel","A","Lime is produced by calcination."
82,"Lime is used as:","Flux in steel melting","Fuel","Lubricant","Coolant","A","Lime removes impurities."
83,"Dust pollution at RMP is controlled using:","Electrostatic precipitators","Cyclones only","Water spray only","Bag filters only","A","Electrostatic precipitators reduce dust."
84,"Capital Repair Group plans:","Capital repairs of major shops","Coal production","Steel sales","Water supply","A","Capital repairs are planned centrally."
85,"Capital Repair Group also executes:","Routine repairs","Product inspection","Ore mining","Laboratory testing","A","Routine repair is another function."
86,"Main objective of Capital Repair Group is:","Ensure availability of vessels and furnaces","Increase exports","Reduce manpower","Increase imports","A","Availability improves production."
87,"Reducing consumption of spares helps to:","Reduce steel production cost","Increase downtime","Increase pollution","Reduce oxygen purity","A","Lower spare consumption lowers costs."
88,"Reducing refractory consumption mainly:","Reduces production cost","Reduces oxygen purity","Increases slag","Reduces water supply","A","Efficient refractory use lowers costs."
89,"Which gas is chemically inert?","Argon","Oxygen","Acetylene","Hydrogen","A","Argon is chemically inert."
90,"Which gas is primarily used as seal gas?","Nitrogen","Oxygen","Argon","Acetylene","A","Nitrogen acts as seal gas."
91,"Which utility supplies slab cutting torches?","Acetylene Plant","Oxygen Plant","Water Management","Foundry","A","Acetylene is used for cutting."
92,"Soft water system mainly supplies:","Chemically treated water","Raw water","Rain water","Waste water","A","Soft water is chemically treated."
93,"Industrial contaminated water is used in:","Gas cleaning plants","Medical use","Drinking","Cooking","A","It serves industrial cleaning processes."
94,"Research laboratories attached to production shops help control:","Quality of inputs","Marketing","Payroll","Recruitment","A","Quality control begins at process level."
95,"Inspection minimizes:","Off-grade products and diversions","Steel production","Oxygen supply","Water demand","A","Proper classification minimizes losses."
96,"Refractory performance depends primarily on:","Quality","Colour","Weight","Shape","A","Quality determines refractory life."
97,"Technological improvements in steel plants have progressed with improvements in:","Refractory technology","Packaging","Payroll","Transport","A","Both have advanced together."
98,"The largest consumer of refractories is:","Steel industry","Automobile industry","Power sector","Construction","A","Steel plants consume most refractories."
99,"Which department ensures product quality before dispatch?","Research and Control Laboratory","Water Management","Capital Repair Group","Foundry","A","RCL tests products before dispatch."
100,"The chapter emphasizes that proper maintenance primarily improves:","Plant reliability and production efficiency","Advertising","Employee attendance","Office administration","A","Effective maintenance ensures reliable steel plant operation."