question_id,question,option_a,option_b,option_c,option_d,correct_answer,explanation
1,"What is the primary function of a Sinter Plant?","Agglomerate iron ore fines into porous sinter","Produce pig iron","Convert hot metal into steel","Manufacture coke","A","A sinter plant agglomerates iron ore fines and other fine materials into a porous mass suitable for blast furnace charging."
2,"Sintering is best defined as:","Mechanical compaction of ore fines","Agglomeration of fines by incipient fusion due to heat","Chemical reduction of iron ore","Cooling of molten iron","B","Sintering is the agglomeration of fine particles through incipient fusion caused by heat."
3,"Why was sintering technology originally developed?","To increase steel production","To utilize waste fines generated in steel plants","To manufacture coke","To produce ferroalloys","B","Sintering was developed to utilize waste fines that could not be directly charged into a blast furnace."
4,"Since its development, sinter has become the preferred:","Steelmaking furnace lining","Blast furnace burden material","Raw material for BOF","Fuel for coke ovens","B","Sinter is the preferred blast furnace burden due to its strength and permeability."
5,"Which of the following is NOT a raw material used in a sinter plant?","Iron ore fines","Coke breeze fines","Burnt lime","Molten pig iron","D","Molten pig iron is not used as a sinter plant raw material."
6,"Which raw material serves as the principal iron-bearing component in sinter making?","Iron ore fines","Dolomite fines","Burnt lime","Mill scale","A","Iron ore fines provide the primary iron content."
7,"Which material acts as the solid fuel during sintering?","Blast furnace slag","Coke breeze","Mill scale","Dolomite","B","Coke breeze supplies the heat required for sintering."
8,"The purpose of the balling drum is to:","Crush sinter cake","Mix raw materials with water and form nodules","Cool finished sinter","Separate return fines","B","The balling drum prepares green mix by nodulization."
9,"The mixture before water addition is called:","Green mix","Base mix","Return fines","Hearth layer","B","The dry proportioned raw materials are called the base mix."
10,"After nodulization, the mixture is known as:","Green mix","Finished sinter","Return fines","Blast burden","A","The nodulized mixture is called green mix."
11,"The hearth layer mainly consists of finished sinter of size:","5–10 mm","10–20 mm","20–40 mm","40–60 mm","B","The hearth layer is formed using 10–20 mm finished sinter."
12,"Green mix is loaded:","Below the hearth layer","Above the hearth layer","Inside the cooler","Inside the crusher","B","The hearth layer is placed first and green mix is charged above it."
13,"The top layer of green mix is ignited in the:","Crusher","Ignition furnace","Cooler","Screen","B","Ignition takes place in the ignition furnace."
14,"Air required for sintering is drawn downward using:","Compressors","Exhausters","Boilers","Converters","B","Exhausters create suction through the sinter bed."
15,"The bonding between particles during sintering occurs mainly because of:","Water evaporation","Burning of coke particles","Mechanical vibration","Cooling air","B","Combustion of coke produces bonding and forms porous sinter."
16,"Sintering is complete when:","Top layer melts","Bottom layer coke burning is completed","Cooling starts","Screening begins","B","Completion is indicated by burning through the entire bed."
17,"After sintering, the sinter cake is first:","Loaded into blast furnace","Crushed","Mixed again","Reheated","B","The sinter cake is crushed before cooling and screening."
18,"The ideal blast furnace sinter size is:","1–5 mm","5–40 mm","40–80 mm","80–100 mm","B","The recommended blast furnace size is 5–40 mm."
19,"The -5 mm sinter fraction is:","Sent to BOF","Returned to sinter bins","Discarded","Used as coke","B","Return fines are recycled back into the process."
20,"The sintering process primarily uses which method?","Rotary kiln method","Under-grate suction method","Electric arc heating","Induction heating","B","Industrial sintering uses the under-grate suction process."
21,"Which gaseous fuel is commonly used in the ignition furnace?","Nitrogen","Coke oven gas","Argon","Hydrogen","B","Coke oven gas or mixed gas is used."
22,"Mixed gas is a combination of:","Oxygen and nitrogen","Coke oven gas and blast furnace gas","Producer gas and LPG","Hydrogen and methane","B","Mixed gas combines COG and BF gas."
23,"How many distinct zones are identified in the sintering process?","4","5","6","7","C","The chapter identifies six distinct zones."
24,"Which zone has the maximum temperature?","Cold sinter zone","Hot sinter zone","Combustion zone","Preheating zone","C","The combustion zone reaches the highest temperature."
25,"The temperature range of the combustion zone is approximately:","60–100°C","100–700°C","1000–1350°C","1500–1700°C","C","The combustion zone reaches about 1000–1350°C."
26,"The maximum temperature attained during sintering is approximately:","700°C","950°C","1300–1350°C","1600°C","C","Peak temperature occurs in the combustion zone."
27,"In which zone do both thermal and chemical reactions occur?","Cold sinter zone","Heating zone","Combustion zone","Recondensation zone","C","Combustion involves oxidation and heat generation."
28,"The movement speed of the combustion zone depends mainly on:","Ore chemistry","Vertical sintering speed","Ambient temperature","Cooling rate","B","Zone movement follows sintering speed."
29,"The disappearance of the combustion zone indicates:","Ignition failure","Completion of sintering","Crusher failure","Cooling completion","B","Burn-through marks the end of sintering."
30,"Heat transfer in sintering mainly occurs from:","Bottom to top","Top to bottom","Side to side","Only at the surface","B","Heat moves downward with the combustion front."
31,"Approximately how much iron ore fines are required to produce one tonne of sinter?","500–600 kg","750–825 kg","900–1000 kg","1100–1200 kg","B","Approximately 750–825 kg of iron ore fines are required per tonne of sinter."
32,"The approximate coke requirement for one tonne of sinter is:","20–30 kg","40–50 kg","65–70 kg","90–100 kg","C","Coke acts as the fuel and is used at about 65–70 kg per tonne."
33,"Approximately how much limestone is used per tonne of sinter?","50–80 kg","100–120 kg","150–180 kg","220–250 kg","C","Limestone acts as a flux and is used at about 150–180 kg."
34,"The approximate dolomite requirement per tonne of sinter is:","5–10 kg","15–20 kg","30–40 kg","60–80 kg","C","Dolomite is added as a flux in the range of 30–40 kg."
35,"Mill scale addition per tonne of sinter is approximately:","10 kg","26 kg","50 kg","80 kg","B","Mill scale addition is approximately 26 kg."
36,"BOF sludge addition per tonne of sinter is approximately:","2 kg","10 kg","20 kg","40 kg","A","BOF sludge is added in a small quantity of about 2 kg."
37,"BOF slag addition per tonne of sinter is approximately:","5 kg","10 kg","20 kg","40 kg","C","BOF slag addition is approximately 20 kg."
38,"Burnt lime addition per tonne of sinter is approximately:","5 kg","10 kg","20 kg","40 kg","C","Burnt lime improves sintering and is added at about 20 kg."
39,"Blast furnace sinter return per tonne of sinter is approximately:","50 kg","100 kg","150 kg","250 kg","B","BF return fines are approximately 100 kg."
40,"Internal sinter return per tonne of sinter is approximately:","150 kg","250 kg","350 kg","456 kg","D","Internal return fines are about 456 kg."
41,"For good sintering, the +10 mm fraction in iron ore fines should be:","Below 5%","Nil","10%","20%","B","The chapter specifies that +10 mm should be nil."
42,"The -1 mm fraction in iron ore fines should be a maximum of:","10%","20%","30%","40%","C","The recommended maximum is 30%."
43,"The maximum recommended alumina content in iron ore fines is:","1.5%","2.0%","2.55%","3.5%","C","Higher alumina increases RDI and reduces quality."
44,"The maximum recommended silica content in iron ore fines is:","2.91%","3.91%","4.91%","5.91%","A","Silica should not exceed 2.91%."
45,"Increasing the +10 mm fraction in iron ore fines results in:","Higher productivity","Weak sinter and low productivity","Higher coke savings","Better permeability","B","Coarse particles reduce bonding."
46,"Increasing the -1 mm fraction mainly decreases:","Ignition temperature","Bed permeability","Basicity","Fuel consumption","B","Very fine particles reduce air flow."
47,"High alumina content primarily increases:","Tumbler Index","Reduction Degradation Index","Basicity","FeO","B","Higher alumina increases RDI."
48,"Higher alumina content can lead to:","Improved reducibility","Chute jamming","Lower return fines","Higher DTI","B","High alumina promotes chute jamming."
49,"Higher silica content increases the:","Ferrite phase","Glassy phase","Lime phase","Metallic iron phase","B","More silica forms a brittle glassy phase."
50,"An increase in the glassy phase makes sinter:","More ductile","More brittle","More porous","More reducible","B","Glassy phases reduce toughness."
51,"The minimum flux crushing index should be:","70%","80%","90%","95%","C","Flux should have at least 90% passing -3 mm."
52,"Poor flux crushing mainly results in:","High FeO","Free lime formation","Higher DTI","Lower RDI","B","Incomplete crushing leaves free lime."
53,"The minimum coke crushing index should be:","75%","80%","85%","90%","C","The recommended coke crushing index is over 85%."
54,"The +5 mm coke fraction should ideally be:","5%","2%","Nil","10%","C","Large coke particles reduce productivity."
55,"Higher +5 mm coke fraction causes:","Higher productivity","Lower productivity","Higher FeO","Lower coke consumption","B","Coarse coke burns inefficiently."
56,"Excessive coke particles below 0.5 mm mainly cause:","Reduced coke consumption","Higher coke consumption","Improved permeability","Lower return fines","B","Very fine coke burns rapidly and inefficiently."
57,"Water added in the balling drum primarily acts as a:","Flux","Binder","Fuel","Coolant","B","Water binds particles during nodulization."
58,"The ideal moisture content of the base mix is:","3–4%","5–6%","7–8%","10–12%","C","The optimum range is 7–8%."
59,"Excess moisture mainly causes:","Higher permeability","Lower permeability","Higher DTI","Higher FeO","B","Too much water blocks air flow."
60,"Insufficient moisture mainly results in:","Better balling","Poor balling and reduced productivity","Higher sinter strength","Higher ignition temperature","B","Low moisture prevents proper granulation."
61,"The ignition furnace temperature is normally maintained at:","800–900°C","950–1050°C","1150–1250°C","1400–1500°C","C","Proper ignition requires 1150–1250°C."
62,"The example mixed gas composition contains approximately ____ CO gas.","22.5%","32.5%","42.5%","52.5%","B","The chapter gives 32.5% CO gas."
63,"The example mixed gas contains approximately ____ BF gas.","47.5%","57.5%","67.5%","77.5%","C","The remaining portion is BF gas."
64,"The mixed gas calorific value is approximately:","900 kcal/m³","1500 kcal/m³","1900 kcal/m³","3000 kcal/m³","C","Mixed gas is maintained around 1900 kcal/m³."
65,"The calorific value of coke oven gas used at BSP is approximately:","2500 kcal/Nm³","3200 kcal/Nm³","4150 kcal/Nm³","5200 kcal/Nm³","C","COG has a much higher calorific value."
66,"Very high ignition temperature mainly causes:","Poor ignition","Fusion of the top layer","Lower return fines","Reduced coke rate","B","Top layer fusion reduces permeability."
67,"Improper ignition mainly increases:","+40 mm fraction","-5 mm return fines","DTI","Basicity","B","Incomplete sintering increases return fines."
68,"The normal coke rate during sintering is approximately:","1–2%","2–3%","3.5–6%","8–10%","C","Normal coke addition is 3.5–6%."
69,"Higher coke rate mainly causes:","Reduced fusion","Top layer fusion","Higher permeability","Lower temperature","B","Too much coke overheats the bed."
70,"Lower coke rate mainly results in:","Complete sintering","Incomplete sintering","Higher productivity","Lower return fines","B","Insufficient fuel prevents complete sintering."
71,"The speed of the sinter machine is primarily adjusted based on:","Ore moisture","Condition of the sintering process","Blast furnace pressure","Cooling water flow","B","Machine speed is varied according to the progress and condition of the sintering process."
72,"BTP stands for:","Blast Temperature Point","Burn Through Point","Bed Temperature Profile","Burning Top Position","B","BTP means Burn Through Point, indicating completion of sintering."
73,"Burn Through Point (BTP) indicates:","Beginning of ignition","Completion of the sintering process","Crusher efficiency","Cooling efficiency","B","BTP is the exhaust gas temperature indicating complete sintering."
74,"BTP is normally observed in the:","First wind box","Middle wind box","Second-last wind box from the discharge end","Cooler outlet","C","The chapter specifies the second-last wind box."
75,"The approximate BTP temperature is:","200°C","300°C","400°C","600°C","C","The normal BTP temperature is around 400°C."
76,"A higher machine speed generally results in:","Lower -5 mm generation","More -5 mm generation","Higher DTI","Higher sinter strength","B","Insufficient sintering time increases return fines."
77,"A lower machine speed generally results in:","Higher productivity","Lower productivity","Lower BTP","Incomplete sintering","B","Very slow movement decreases overall productivity."
78,"The finished sinter cake is initially crushed to approximately:","50 mm","75 mm","100 mm","150 mm","C","The sinter cake is crushed to about 100 mm."
79,"Cooling of crushed sinter is carried out mainly by:","Water spray","Forced-draught air blowers","Natural cooling","Steam injection","B","Forced air cools the sinter."
80,"The cooler discharge temperature is normally maintained at:","20–40°C","40–60°C","60–80°C","100–120°C","C","The desired outlet temperature is 60–80°C."
81,"For effective cooling, larger sinter pieces should be placed:","At the top","At the bottom","In the middle","Randomly","B","Larger particles remain at the bottom for efficient airflow."
82,"Smaller sinter particles should preferably remain:","At the bottom","At the top","Near the crusher","Near the feeder","B","Smaller particles are placed on top for effective cooling."
83,"The 15–20 mm sinter fraction is mainly used as:","Blast furnace feed","Hearth layer","Return fines","Crusher feed","B","This size fraction forms the hearth layer."
84,"After final screening, the +10 mm fraction should be at least:","50%","55%","65%","75%","C","Blast furnace quality requires +10 mm ≥65%."
85,"After screening, the -5 mm fraction should not exceed:","4%","6%","8%","10%","B","The acceptable maximum is 6%."
86,"One major objective of sintering is to:","Increase coke ash","Utilize iron ore fines","Increase slag volume","Reduce iron content","B","Sintering converts unusable ore fines into useful burden."
87,"Which metallurgical waste can be effectively utilized through sintering?","Mill scale","BOF sludge","LD slag","All of the above","D","The process utilizes several metallurgical wastes."
88,"Coke breeze used in sintering is mainly obtained from:","Blast furnace","Coke screening","BOF converter","Sinter cooler","B","Coke breeze is generated during coke screening."
89,"Calcination of flux in the sinter strand primarily helps:","Increase slag volume","Reduce blast furnace coke consumption","Increase moisture","Increase return fines","B","Pre-calcined flux reduces coke requirement."
90,"Increasing the proportion of sinter in blast furnace burden mainly improves:","Gas permeability","Ash content","Sulphur content","Moisture content","A","Higher sinter percentage improves burden permeability."
91,"Improved burden permeability results in:","Lower productivity","Higher productivity","Higher moisture","Higher dust generation","B","Better gas flow improves furnace productivity."
92,"Higher sinter percentage generally results in:","Higher blast furnace coke rate","Lower blast furnace coke rate","No effect","Higher phosphorus","B","Sinter improves efficiency and lowers coke consumption."
93,"Sintering helps reduce the harmful effect of:","Sulphur","Phosphorus","Zinc and alkalis","All of the above","D","Several undesirable impurities are reduced."
94,"One important benefit of using sinter is:","Reduced hot metal quality","Improved hot metal quality","Higher slag volume","Lower permeability","B","Good-quality sinter improves hot metal quality."
95,"Compared to raw burden materials, sinter has:","Lower softening temperature","Higher softening temperature","Same softening temperature","No melting zone","B","Higher softening temperature improves furnace operation."
96,"The melting zone of sinter is generally:","Very wide","Narrow","Absent","Irregular","B","A narrow melting zone improves blast furnace performance."
97,"A narrower cohesive zone in the blast furnace leads to:","Poor gas flow","Improved furnace driving rate","Higher coke rate","Higher moisture","B","Gas flow improves through a narrower cohesive zone."
98,"The FeO content of blast furnace sinter should generally be:","2–4%","5–7%","8–11%","12–15%","C","The recommended FeO range is 8–11%."
99,"The MgO content in sinter is maintained at approximately:","1–2%","2.6–3.0%","4–5%","6–7%","B","The quality parameter specifies 2.6–3.0%."
100,"The available lime (CaO−SiO₂) range in sinter is approximately:","1–2","2–3","3.4–6","7–8","C","Available lime is maintained within 3.4–6."
101,"The SiO₂ content of sinter should generally be:","2–3%","3–4%","4.8–5.2%","6–7%","C","The recommended silica range is 4.8–5.2%."
102,"The target Al₂O₃ content in sinter is approximately:","2.0%","2.5%","3.0%","4.5%","C","Al₂O₃ is maintained around 3%."
103,"The recommended basicity of sinter is:","0.8–1.2","1.6–2.1","2.5–3.0","3.5–4.0","B","The chapter specifies 1.6–2.1."
104,"The average sinter size should be approximately:","10–15 mm","18–21 mm","25–30 mm","35–40 mm","B","Mean sinter size is maintained between 18 and 21 mm."
105,"The minimum acceptable DTI value is:","50%","60%","70%","80%","C","DTI should be at least 70%."
106,"The maximum acceptable RDI value is:","20%","30%","40%","50%","B","RDI should not exceed 30%."
107,"The maximum allowable +40 mm fraction is:","5%","7%","9%","12%","C","+40 mm fraction should be ≤9%."
108,"The tumbler index (DTI) primarily measures:","Chemical composition","Cold mechanical strength","Moisture content","Fuel efficiency","B","DTI evaluates resistance to impact and abrasion."
109,"DTI is mainly related to the tendency of sinter to:","Melt","Form fines during handling","Absorb moisture","Increase FeO","B","Higher DTI means lower degradation."
110,"Which mineral phase has the highest fracture strength?","Ferrites","Magnetite","Secondary hematite","Primary hematite","D","Primary hematite possesses the greatest fracture strength."
111,"According to the chapter, the fracture strength of sinter mineral phases is highest for:","Ferrites","Magnetite","Secondary hematite","Primary (residual) hematite","D","Primary hematite has the highest fracture strength among the mineral phases."
112,"Which mineral phase has a higher fracture strength than magnetite?","Ferrites","Secondary hematite","Wustite","Lime","B","Secondary hematite is stronger than magnetite."
113,"The correct order of fracture strength is:","Ferrites > Magnetite > Secondary Hematite > Primary Hematite","Primary Hematite > Secondary Hematite > Magnetite > Ferrites","Magnetite > Ferrites > Primary Hematite > Secondary Hematite","Secondary Hematite > Ferrites > Magnetite > Primary Hematite","B","The chapter provides this exact order."
114,"Cold mechanical strength of sinter mainly influences:","Basicity","Formation of fines during handling","Moisture content","Ignition temperature","B","Higher cold strength reduces fines generation."
115,"Reduction Degradation Index (RDI) measures:","Hot strength","Low-temperature degradation during reduction","Coke consumption","Blast furnace productivity","B","RDI evaluates degradation during reduction."
116,"The standard RDI test is carried out at approximately:","250°C","400°C","550°C","800°C","C","The chapter specifies 550°C."
117,"For good blast furnace performance, the RDI value should be:","As high as possible","As low as possible","Equal to DTI","Above 70%","B","Lower RDI indicates better resistance to degradation."
118,"RDI is mainly used to predict degradation of sinter in the:","Coke oven","Lower part of the blast furnace stack","BOF converter","Continuous casting machine","B","RDI predicts low-temperature degradation in the furnace."
119,"The Coke Crushing Index is defined as the percentage of:","+5 mm coke","-3 mm coke fraction","-5 mm coke fraction","+10 mm coke fraction","B","It represents the percentage of -3 mm coke."
120,"For efficient sintering, the Coke Crushing Index should be:","More than 70%","More than 75%","More than 85%","More than 95%","C","The recommended minimum is greater than 85%."
121,"The Flux Crushing Index represents the percentage of:","+3 mm flux","-3 mm flux","-5 mm flux","+10 mm flux","B","Flux crushing index is based on the -3 mm fraction."
122,"For efficient sintering, the Flux Crushing Index should exceed:","75%","80%","85%","90%","D","The desired value is more than 90%."
123,"Burn Through Point (BTP) is primarily used to indicate:","Completion of crushing","Completion of sintering","Completion of cooling","Completion of screening","B","BTP confirms the completion of sintering."
124,"The BTP is generally observed near the:","Feed end","Middle of the machine","Second-last wind box from discharge end","Cooler outlet","C","This location is specified in the chapter."
125,"Which equipment is mainly responsible for mixing and pelletizing the base mix?","Cooler","Balling drum","Hammer crusher","Screen","B","The balling drum performs mixing and nodulization."
126,"Sintering actually takes place on the:","Cooler","Conveyor","Sinter pallets","Rod mill","C","The moving pallets carry out the sintering process."
127,"Which equipment separates different size fractions of sinter?","Crusher","Screen","Exhauster","Cyclone","B","Screens classify sinter into different sizes."
128,"The primary function of crushers in a sinter plant is to:","Mix raw materials","Crush the sinter cake","Cool finished sinter","Store return fines","B","Crushers reduce sinter cake size."
129,"Coolers in a sinter plant are mainly used to:","Increase moisture","Normalize and cool sinter","Crush flux","Mix coke","B","Coolers reduce sinter temperature before screening."
130,"Exhausters are essentially:","Cooling towers","High-capacity suction fans","Rotary kilns","Dust collectors","B","Exhausters draw air through the sinter bed."
131,"The primary function of exhausters is to:","Supply oxygen to BOF","Draw air below the sinter bed","Transport raw materials","Screen sinter","B","They create the under-grate suction."
132,"Battery cyclones are mainly used to:","Ignite sinter","Clean exhaust gases","Cool sinter","Crush coke","B","Cyclones remove dust from exhaust gases."
133,"ESP in a sinter plant stands for:","Electric Safety Panel","Electrostatic Precipitator","Emergency Shutdown Process","Energy Supply Plant","B","ESP cleans exhaust gases by removing dust."
134,"Electronic feeders are installed in:","Coolers","Proportioning bins","Crushers","Cyclones","B","They regulate raw material feeding."
135,"The main purpose of electronic feeders is to:","Crush ore","Adjust feed rate","Ignite coke","Cool sinter","B","Feeders ensure correct raw material proportioning."
136,"Conveyors in the proportioning section mainly:","Crush limestone","Transport charge mix","Generate suction","Cool sinter","B","Conveyors transport materials between units."
137,"Bunkers are primarily used for:","Screening sinter","Storing raw materials","Cooling coke","Igniting green mix","B","Bunkers provide storage."
138,"Roll crushers are commonly used for crushing:","Finished sinter","Coke","Limestone slurry","Blast furnace slag","B","Roll crushers prepare coke."
139,"Rod mills are mainly used for crushing:","Flux materials","Finished sinter","Green mix","Iron ore pellets","A","Rod mills crush fluxes."
140,"Grab cranes are mainly used for:","Lifting coke","Cooling sinter","Mixing ore","Ignition","A","Grab cranes handle coke."
141,"Specific productivity is defined as:","Power consumed per tonne","Gas consumed per tonne","Sinter produced per square metre per hour","Flux consumed per tonne","C","It measures production rate."
142,"Specific heat consumption represents:","Electricity used per tonne","Gas consumed per tonne of sinter","Water consumed per tonne","Ore consumed per tonne","B","Heat consumption is measured using gas usage."
143,"Specific power consumption is the:","Power consumed per tonne of sinter","Gas consumed per hour","Power generated per tonne","Heat recovered","A","It is a techno-economic parameter."
144,"Specific coke consumption refers to:","Coke generated per tonne","Coke consumed per tonne of sinter","Coke ash percentage","Return coke fraction","B","It measures coke efficiency."
145,"Specific flux consumption indicates:","Flux consumed per tonne of sinter","Flux produced","Flux recovery","Flux moisture","A","Lower flux consumption is economically desirable."
146,"For economical sinter production, specific productivity should be:","Minimum","Maximum","Zero","Constant","B","Higher productivity reduces production cost."
147,"For economical operation, specific heat consumption should be:","Maximum","Minimum","Equal to power consumption","Twice coke consumption","B","Lower gas consumption reduces cost."
