question_id,question,option_a,option_b,option_c,option_d,correct_answer,explanation
148,"For economical operation, specific power consumption should be:","Maximum","Minimum","Equal to heat consumption","Independent of quality","B","Lower power consumption is desirable."
149,"For economical operation, specific coke consumption should be:","Maximum","Minimum","Constant","Equal to flux consumption","B","Lower coke consumption reduces production cost."
150,"For economical operation, specific flux consumption should be:","Minimum","Maximum","Equal to ore consumption","Independent of productivity","A","Lower flux consumption improves techno-economic performance."
151,"Which of the following is the major source of dust pollution in a sinter plant?","Molten steel","Large quantity of fine particles","Cooling water","Blast furnace gas","B","Fine raw materials generate significant dust during handling and sintering."
152,"Efficient ________ is essential for controlling dust pollution in a sinter plant.","Cooling","Ventilation","Lubrication","Pelletizing","B","Proper ventilation minimizes airborne dust."
153,"Which personal protective equipment (PPE) is mandatory in dusty areas of a sinter plant?","Safety goggles","Dust mask","Face shield","Leather gloves","B","Dust masks protect workers from inhaling fine particles."
154,"The chimney stack emission limit mentioned in the chapter is:","20 mg/Nm³","50 mg/Nm³","75 mg/Nm³","100 mg/Nm³","B","The specified stack emission limit is 50 mg/Nm³."
155,"The permissible fugitive (ambient) emission level mentioned is:","1 mg/Nm³","2 mg/Nm³","5 mg/Nm³","10 mg/Nm³","B","The chapter specifies a fugitive emission value of 2 mg/Nm³."
156,"Which gases are commonly used for ignition in the sinter plant?","Oxygen and Nitrogen","Mixed gas and Coke Oven Gas","Hydrogen and Argon","LPG only","B","Mixed gas and Coke Oven Gas are used for ignition."
157,"While working on gas lines, which instrument is compulsory?","Thermometer","CO gas monitor","Flow meter","Pressure gauge","B","Carbon monoxide monitoring is essential for safety."
158,"Which PPE is mandatory while working on gas lines?","Face shield","Gas mask","Ear plug","Safety belt","B","Gas masks protect workers from hazardous gases."
159,"The major source of noise in a sinter plant is the:","Cooling tower","Exhauster fan","Ignition furnace","Rod mill","B","Exhausters generate very high noise due to air suction."
160,"Leakage in the suction line mainly causes:","Lower productivity","High noise levels","Higher DTI","Improved cooling","B","Air leakage increases noise generated by exhausters."
161,"Which of the following is also a high-noise area in a sinter plant?","Control room","Air compressor","Laboratory","Water treatment plant","B","Air compressors produce significant noise."
162,"Hammer crushers are considered:","Low-noise equipment","High-noise equipment","Dust collectors","Gas cleaning equipment","B","Hammer crushers generate high noise levels."
163,"Which PPE is essential in high-noise areas?","Dust mask","Ear plug","Safety belt","Respirator","B","Ear plugs protect against hearing damage."
164,"ISO 45001:2018 primarily deals with:","Environmental Management","Occupational Health and Safety Management System","Quality Management","Energy Management","B","ISO 45001 is the international standard for OH&S management."
165,"OH&SMS stands for:","Occupational Health and Safety Management System","Operational Heat and Safety Management System","Organized Hazard and Safety Monitoring System","Occupational Hazard Supervision Mechanism","A","OH&SMS is the accepted expansion."
166,"The primary objective of OH&SMS is to:","Increase production","Identify hazards and control risks","Reduce raw material cost","Increase machine speed","B","The system focuses on worker health and safety."
167,"OH&SMS assists an organization in ensuring:","Legal compliance","Higher blast furnace productivity","Higher FeO","Lower basicity","A","Compliance with legislation is one of its objectives."
168,"OH&SMS also ensures proper:","Employee consultation and communication","Ore beneficiation","Coal blending","Slag granulation","A","Communication and consultation are key elements."
169,"OH&SMS requires organizations to ensure employee:","Competency","Promotion","Salary revision","Shift rotation","A","Employee competency is an essential requirement."
170,"OH&SMS includes arrangements to deal with:","Equipment purchase","Foreseeable emergencies","Export policies","Fuel pricing","B","Emergency preparedness is part of the system."
171,"ISO 45001 is NOT primarily concerned with:","Employee safety","Hazard identification","Safety of the product","Risk control","C","The standard focuses on occupational health and safety, not product safety."
172,"ISO 45001 is compatible with:","ISO 9001 only","ISO 14001 only","Both ISO 9001 and ISO 14001","ISO 50001 only","C","The chapter states compatibility with ISO 9001 and ISO 14001."
173,"ISO 9001 relates mainly to:","Quality Management","Environmental Management","Energy Management","Occupational Safety","A","ISO 9001 is the Quality Management System."
174,"ISO 14001 relates mainly to:","Quality Management","Environmental Management","Financial Management","Maintenance Management","B","ISO 14001 covers Environmental Management."
175,"Integration of ISO 45001 with ISO 9001 and ISO 14001 helps organizations by:","Increasing fuel consumption","Creating an integrated management system","Reducing iron content","Increasing emissions","B","Integrated management improves overall efficiency."
176,"A fully implemented OH&SMS helps in reducing:","Production","Risks and losses","Iron ore quality","Machine capacity","B","Risk reduction is one of the major benefits."
177,"One benefit of OH&SMS is the reduction of:","Accidents and incidents","Blast furnace volume","Ore grade","Basicity","A","Improved safety reduces accidents."
178,"OH&SMS contributes to:","Reliable operations","Higher coke ash","Higher emissions","Reduced ventilation","A","Reliable operations are listed among the benefits."
179,"A systematic approach to workplace health and safety improves the company's:","Iron content","Image and reputation","Slag basicity","Fuel ratio","B","Good safety practices improve corporate reputation."
180,"Which of the following is NOT listed as an impact of OH&SMS?","Reduced accidents","Reliable operations","Higher emissions","Improved company image","C","Higher emissions are not a benefit."
181,"Which raw material is recycled back after screening in the sinter plant?","+40 mm fraction","-5 mm return fines","Burnt lime","Dolomite","B","The -5 mm fraction is recycled to improve material utilization."
182,"The hearth layer protects the:","Cooler","Pallet grates","Crusher","Conveyor","B","The hearth layer prevents direct exposure of grates to high temperature."
183,"The combustion front in a sinter bed moves:","Upward","Downward","Horizontally","Randomly","B","Air suction causes the combustion front to move downward."
184,"The porous nature of sinter mainly improves:","Blast furnace permeability","Dust generation","Slag volume","Water absorption","A","Porous sinter allows better gas flow."
185,"The principal purpose of adding water in the balling drum is to improve:","Chemical composition","Granulation and permeability","Iron content","Fuel value","B","Water aids ball formation and improves bed permeability."
186,"The major indicator used by operators to judge completion of sintering is:","DTI","RDI","BTP","FeO","C","Burn Through Point confirms complete sintering."
187,"Which parameter should be kept as low as possible for economical operation?","Specific productivity","Specific heat consumption","Sinter strength","DTI","B","Lower heat consumption reduces production cost."
188,"The strongest mineral phase contributing to good tumbler index is:","Ferrites","Magnetite","Primary hematite","Glassy phase","C","Primary hematite has the highest fracture strength."
189,"The principal objective of recycling return fines is to:","Increase waste","Improve material utilization","Increase emissions","Reduce permeability","B","Return fines improve raw material utilization and process economy."
190,"According to the chapter, the overall objective of sintering is to convert fine materials into:","Molten iron","Strong porous blast furnace burden","Steel slabs","Pellets","B","Sintering produces strong, porous sinter suitable for blast furnace charging."