question_id,question,option_a,option_b,option_c,option_d,correct_answer,explanation
Q0093,"The calorific value maintained using the BF gas and CO gas mixture is approximately:","1200 kcal/m³","1500 kcal/m³","1900 kcal/m³","3000 kcal/m³","C","The mixed gas is adjusted to provide a calorific value of about 1900 kcal/m³ for ignition. "
Q0094,"The calorific value of Coke Oven Gas (COG) used at Bhilai Steel Plant is approximately:","1900 kcal/Nm³","2500 kcal/Nm³","4150 kcal/Nm³","6000 kcal/Nm³","C","The chapter specifies that Coke Oven Gas used at BSP has a calorific value of about 4150 kcal/Nm³. "
Q0095,"The normal coke rate in the sinter mix is approximately:","1–2% of total charge","2–3% of total charge","3.5–6% of total charge","8–10% of total charge","C","Coke constitutes approximately 3.5–6% of the total sinter charge and acts as the solid fuel. "
Q0096,"Burn Through Point (BTP) is defined as:","The ignition temperature of the green mix","The exhaust gas temperature indicating completion of sintering","The maximum combustion temperature","The cooler discharge temperature","B","BTP is the exhaust gas temperature that signifies completion of the sintering process. "
Q0097,"After crushing, the finished sinter cake is normally reduced to a maximum size of approximately:","40 mm","60 mm","100 mm","150 mm","C","The sinter cake is crushed to about 100 mm before cooling and screening. "
Q0098,"Which fan is primarily used for cooling the crushed sinter on the cooler?","Induced Draft Fan","Forced Draught Fan","Axial Flow Fan","Exhauster","B","Cooling is carried out by forced draught fans that blow air through the sinter bed. "
Q0099,"According to blast furnace requirements, the maximum permissible −5 mm fraction in finished sinter is:","3%","5%","6%","10%","C","The finished sinter should contain not more than 6% of −5 mm fines. "
Q0100,"The primary reason for recycling −5 mm sinter back to the sinter plant is to:","Reduce limestone consumption","Recover valuable iron-bearing material and improve process economy","Increase blast furnace slag","Reduce moisture content","B","Return fines are recycled to recover iron units, minimize waste and improve overall plant economy.
Q0101,"Which of the following is the MOST important reason for using sinter instead of directly charging iron ore fines into a blast furnace?","Iron ore fines contain excessive carbon","Iron ore fines have poor permeability and cannot be directly charged efficiently","Iron ore fines melt at a lower temperature","Iron ore fines contain excessive sulphur","B","Fine particles drastically reduce blast furnace permeability. Sintering agglomerates these fines into strong porous lumps, making them suitable for efficient blast furnace operation. "
Q0102,"The major bonding mechanism responsible for sinter formation is:","Complete melting of iron ore","Incipient fusion between particles","Mechanical compaction","Chemical precipitation","B","Sinter is formed by incipient fusion where only particle surfaces soften and bond together rather than complete melting. "
Q0103,"Which statement correctly describes the combustion front during sintering?","It moves upward from the grate.","It remains stationary.","It moves downward due to under-grate suction.","It moves randomly through the bed.","C","Air is sucked downward by exhausters, causing the combustion zone to travel downward until the entire bed is sintered. "
Q0104,"Why is sinter intentionally made porous?","To reduce iron content","To improve blast furnace gas permeability and reducibility","To increase moisture absorption","To decrease mechanical strength","B","A porous structure allows reducing gases to pass easily through the burden, improving reduction efficiency and blast furnace productivity. "
Q0105,"Which operating parameter has the GREATEST direct influence on bed permeability?","Machine colour","Moisture content of the green mix","Cooling water temperature","Crusher setting","B","Proper moisture (7–8%) ensures good balling and bed permeability. Both excess and insufficient moisture reduce productivity. "
Q0106,"If the ignition furnace temperature is excessively high, which sequence of events is MOST likely?","Improved permeability → Higher productivity","Top layer fusion → Reduced permeability → Lower productivity","Incomplete ignition → More return fines","Lower coke consumption → Higher productivity","B","Excessive ignition temperature fuses the top layer, restricting airflow through the bed and lowering productivity. "
Q0107,"During operation, the Burn Through Point (BTP) shifts towards the discharge end. This generally indicates:","Sintering is progressing normally","The cooler has failed","The crusher is overloaded","The ESP efficiency has increased","A","The BTP is monitored to ensure the combustion front reaches the proper location, indicating complete sintering. "
Q0108,"A sudden increase in return fines (−5 mm) is MOST likely caused by:","Proper ignition and correct machine speed","Incomplete sintering due to poor operating conditions","Higher tumbler index","Improved bed permeability","B","Incomplete sintering caused by improper ignition, excessive machine speed, low coke rate or poor permeability increases return fines. "
Q0109,"Which quality parameter is more important for evaluating degradation of sinter inside the blast furnace during reduction?","DTI","RDI","Basicity","Mean Size","B","RDI measures degradation during reduction at about 550°C and is a key blast furnace performance indicator. "
Q0110,"A sinter having high DTI and low RDI is considered:","Poor quality","Excellent blast furnace burden","Unsuitable for transportation","Suitable only for pellet plants","B","High DTI indicates good cold strength, while low RDI indicates good resistance to degradation during reduction—both desirable properties. "
Q0111,"Which equipment directly determines the proportion of each raw material entering the sinter mix?","Cooler","Electronic feeder","Crusher","ESP","B","Electronic feeders accurately regulate raw material feed rates according to the charge calculation. "
Q0112,"Which equipment is primarily responsible for maintaining environmental compliance by removing particulate matter from exhaust gas?","Wind box","ESP","Balling drum","Cooler","B","The Electrostatic Precipitator (ESP) removes fine dust particles before exhaust gases are released into the atmosphere. "
Q0113,"The MOST economical operation of a sinter plant is achieved when:","Specific productivity is minimum","Specific productivity is maximum while specific consumptions are minimum","Specific coke consumption is maximum","Specific heat consumption is maximum","B","Economic operation requires maximizing productivity while minimizing heat, power, coke and flux consumption. "
Q0114,"Why does super-fluxed sinter reduce coke consumption in the blast furnace?","It contains additional coal","Flux calcination has already occurred during sintering","It lowers blast temperature","It reduces oxygen enrichment","B","Since flux decomposition occurs during sintering, the blast furnace requires less energy for calcination, reducing coke consumption. "
Q0115,"Which safety hazard requires continuous monitoring using a CO gas detector?","Noise pollution","Dust pollution","Gas line maintenance involving mixed gas or coke oven gas","Mechanical maintenance","C","Carbon monoxide is highly toxic; therefore, CO monitoring is mandatory during work on gas lines. "
Q0116,"ISO 45001:2018 primarily emphasizes:","Increasing production targets","Systematic identification of hazards and risk control","Product quality inspection","Inventory management","B","ISO 45001 focuses on occupational health and safety by systematically identifying hazards and implementing controls. "
Q0117,"Which combination of properties is MOST desirable for blast furnace sinter?","Low DTI and High RDI","High DTI and Low RDI","High RDI and Low FeO","Low Basicity and High RDI","B","High cold strength (DTI) and low degradation during reduction (RDI) together provide the best blast furnace performance. "
Q0118,"From an examination perspective, which parameter directly indicates completion of the sintering process?","Ignition temperature","Cooler discharge temperature","Burn Through Point (BTP)","Specific productivity","C","BTP is the single most important operational indicator confirming complete sintering and is frequently asked in SAIL JO examinations. "
Q0119,"Which is the MOST critical function of under-grate suction during sintering?","Cooling the bed","Transporting raw materials","Propagating the combustion zone downward through the bed","Reducing moisture only","C","Without under-grate suction, the combustion front cannot travel downward and proper sintering cannot occur. "
Q0120,"A candidate is asked in the SAIL JO Promotion Exam: 'Which single operating parameter is routinely monitored to judge whether the sintering process has been completed?' The correct answer is:","DTI","RDI","Burn Through Point (BTP)","Specific Heat Consumption","C","Burn Through Point (approximately 400°C near the second-last wind box) is the operational parameter used to confirm completion of the sintering process. This is one of the highest-probability SAIL JO examination questions.
Q0121,"Which raw material is primarily responsible for providing the iron-bearing constituent in the sinter mix?","Limestone fines","Iron ore fines","Dolomite","Burnt lime","B","Iron ore fines are the principal iron-bearing material used in the sinter mix. Sintering was developed mainly to utilize these fines efficiently in the blast furnace. "
Q0122,"The principal objective of adding water in the balling drum is to:","Cool the raw mix","Act as a binder and improve nodulization","Reduce coke consumption","Increase FeO content","B","Water acts as a binder, producing strong green nodules and improving bed permeability, which is essential for efficient sintering. "
Q0123,"Which of the following best explains why under-grate suction is indispensable in sintering?","It supplies cooling water","It removes slag","It enables combustion gases to pass through the bed, allowing the flame front to travel downward","It increases moisture in the bed","C","Under-grate suction created by exhausters is the fundamental principle behind the Dwight-Lloyd sintering process. "
Q0124,"Which operating condition is MOST likely to reduce bed permeability?","Optimum moisture","Very high ignition temperature causing top layer fusion","Correct coke rate","Proper balling","B","Fusion of the top layer blocks gas flow through the bed, decreasing permeability and reducing productivity. "
Q0125,"The most important purpose of maintaining optimum machine speed is to:","Increase cooler capacity","Ensure Burn Through Point occurs at the correct location","Reduce ESP load","Increase crusher efficiency","B","Machine speed is adjusted so that the combustion front reaches the discharge end at the proper location, ensuring complete sintering. "
Q0126,"If Burn Through Point (BTP) occurs too early due to a very low machine speed, the result is generally:","Higher productivity","Lower productivity due to excessive residence time","Increase in return fines only","Better permeability","B","Very low machine speed increases residence time, lowering overall plant productivity even though sintering is complete. "
Q0127,"Why are metallurgical wastes such as BOF sludge, mill scale and LD slag added to the sinter mix?","To increase moisture","To recover valuable iron units and reduce waste disposal","To reduce FeO","To replace limestone completely","B","One of the biggest advantages of sintering is the economical recycling of iron-bearing metallurgical wastes. "
Q0128,"Which of the following quality parameters should be LOW for good blast furnace performance?","DTI","Mean Size","RDI","Available Lime","C","Lower Reduction Degradation Index (RDI) means less degradation of sinter during reduction, resulting in smoother blast furnace operation. "
Q0129,"Which quality parameter should be HIGH for better resistance to handling and transportation?","RDI","DTI","Al₂O₃","SiO₂","B","A higher Tumbler Index (DTI) indicates superior cold strength and resistance to impact and abrasion. "
Q0130,"Which emission limit is specified for chimney stack emission in the Sinter Plant chapter?","25 mg/Nm³","40 mg/Nm³","50 mg/Nm³","75 mg/Nm³","C","The specified chimney stack emission limit is 50 mg/Nm³, making it an important numerical fact for examinations. "
Q0131,"The ambient (fugitive) dust emission limit mentioned in the chapter is:","1 mg/Nm³","2 mg/Nm³","5 mg/Nm³","10 mg/Nm³","B","The chapter specifies fugitive (ambient) emission of 2 mg/Nm³. This is an important numerical value often asked in SAIL examinations. "
Q0132,"Which PPE is mandatory while working on gas lines in a sinter plant?","Safety shoes only","Gas mask and Carbon Monoxide (CO) monitor","Face shield only","Cotton gloves only","B","Because mixed gas and coke oven gas contain toxic CO, both a gas mask and CO monitor are mandatory. "
Q0133,"Which equipment is NOT listed as a major source of high noise in the sinter plant?","Hammer crusher","Air compressor","Balling drum","Exhauster fan","C","The chapter identifies exhausters, compressors, chillers and crushers as high-noise areas. Balling drums are not specifically listed. "
Q0134,"ISO 45001:2018 can be integrated most effectively with:","ISO 22000 and ISO 50001","ISO 9001 and ISO 14001","ISO 17025 and ISO 13485","ISO 27001 and ISO 20000","B","ISO 45001 is designed to integrate with ISO 9001 (Quality) and ISO 14001 (Environmental Management). "
Q0135,"Which of the following is NOT an objective of ISO 45001:2018?","Hazard identification","Occupational risk control","Ensuring product quality for customers","Improving workplace safety","C","ISO 45001 focuses on occupational health and safety rather than product quality, which is addressed by ISO 9001. "
Q0136,"The term 'Specific Coke Consumption' refers to:","Coke used per tonne of hot metal","Coke consumed per tonne of sinter produced","Coke produced per tonne of coal","Coke stored per shift","B","Specific Coke Consumption is one of the important techno-economic indicators and represents coke consumption per tonne of sinter. "
Q0137,"Which techno-economic parameter directly indicates the efficiency of machine utilization?","Specific Flux Consumption","Specific Heat Consumption","Specific Productivity","Specific Power Consumption","C","Specific productivity (tonnes of sinter per square metre per hour) directly reflects utilization of the sinter machine. "
Q0138,"According to the chapter, the blast furnace generally requires sinter having a mean size of:","10–12 mm","14–16 mm","18–21 mm","25–30 mm","C","The quality parameter table specifies a mean sinter size of 18–21 mm for efficient blast furnace operation. "
Q0139,"The specified maximum percentage of +40 mm sinter is:","5%","7%","9%","12%","C","The quality specification limits the +40 mm fraction to a maximum of 9%. Oversized sinter can adversely affect burden distribution. "
Q0140,"Which one of the following is considered one of the MOST frequently tested numerical values from the Sinter Plant chapter in SAIL JO examinations?","COG calorific value ≈ 4150 kcal/Nm³","Iron melting point","Density of limestone","Specific gravity of coke","A","The calorific value of Coke Oven Gas (≈4150 kcal/Nm³), along with BTP (~400°C), ignition temperature (1150–1250°C), moisture (7–8%), and sinter size (5–40 mm), are among the highest-yield numerical facts for the SAIL JO Promotion Exam.
Q0141,"Which raw material in the sinter mix acts primarily as the source of basicity?","Iron ore fines","Limestone and dolomite","Mill scale","BOF sludge","B","Limestone (CaCO₃) and dolomite provide CaO and MgO after decomposition, controlling the basicity of the sinter. "
Q0142,"The principal purpose of adding burnt lime to the sinter mix is to:","Increase moisture","Improve granulation and bonding of the green mix","Reduce FeO content","Act as fuel","B","Burnt lime improves granulation (nodulization), resulting in better bed permeability and stronger green mix. "
Q0143,"Which factor has the greatest influence on the quality of the finished sinter?","Paint color of equipment","Quality of input raw materials","Number of conveyors","Ambient temperature","B","The chapter identifies the quality of input raw materials as the first and one of the most important factors affecting sintering. "
Q0144,"If the alumina (Al₂O₃) content in iron ore fines increases beyond the recommended limit, which problem is expected?","Lower RDI","Higher RDI with increased generation of fines","Higher DTI","Reduced return fines","B","Higher alumina increases the Reduction Degradation Index (RDI), resulting in more −5 mm generation and chute jamming. "
Q0145,"An increase in silica (SiO₂) content in iron ore fines primarily increases the:","Metallic iron content","Glassy phase, making sinter brittle","Porosity only","Cold strength","B","Higher silica promotes formation of a glassy phase, increasing brittleness of the sinter. "
Q0146,"The recommended minimum coke crushing index is:","70%","75%","85%","95%","C","For efficient combustion and productivity, the coke crushing index (−3 mm fraction) should be greater than 85%. "
Q0147,"The recommended minimum flux crushing index is:","75%","80%","90%","95%","C","The flux crushing index should be at least 90% to ensure proper flux distribution and sinter quality. "
Q0148,"What is the principal function of the hearth layer?","Provide additional fuel","Protect the pallets and ensure uniform air flow during sintering","Reduce moisture","Increase sinter basicity","B","The hearth layer protects the pallets from excessive heat and maintains proper gas flow through the bed. "
Q0149,"The ideal blast furnace sinter size specified in the chapter is:","0–10 mm","5–40 mm","10–60 mm","20–80 mm","B","The ideal size of sinter charged to the blast furnace is 5–40 mm. Material below 5 mm is recycled. "
Q0150,"Which one of the following parameters is considered the MOST important operational indicator for controlling sinter machine speed?","RDI","DTI","Burn Through Point (BTP)","Basicity","C","Machine speed is adjusted based on the Burn Through Point (BTP), which indicates completion of the sintering process. "
Q0151,"Which equipment is used to crush the finished sinter cake before cooling?","Rod mill","Crusher","ESP","Balling drum","B","The finished sinter cake is crushed to approximately 100 mm before entering the cooler. "
Q0152,"The principal purpose of the cooler is to reduce the sinter temperature to approximately:","20–30°C","40–50°C","60–80°C","100–120°C","C","Cooling to about 60–80°C is required before screening and dispatch to the blast furnace. "
Q0153,"Which equipment removes coarse dust from exhaust gases before the ESP?","Crusher","Battery Cyclone","Cooler","Electronic Feeder","B","Battery cyclones act as primary dust collectors before the exhaust gases enter the Electrostatic Precipitator. "
Q0154,"Which equipment is responsible for transporting the charge mix between different sections of the plant?","Conveyors","Coolers","Wind Boxes","Grab Cranes","A","Conveyors transport raw materials and charge mix throughout the sinter plant. "
Q0155,"Which techno-economic parameter represents power consumed per tonne of sinter?","Specific Productivity","Specific Heat Consumption","Specific Power Consumption","Specific Coke Consumption","C","Specific Power Consumption is defined as electrical power consumed per tonne of sinter produced. "
Q0156,"Which techno-economic parameter represents flux consumed per tonne of sinter?","Specific Flux Consumption","Specific Productivity","Specific Heat Consumption","Specific Coke Consumption","A","Specific Flux Consumption measures the amount of flux required to produce one tonne of sinter. "
Q0157,"The use of super-fluxed sinter in the blast furnace primarily results in:","Higher coke rate","Improved reducibility and reduced coke consumption","Higher slag generation","Lower permeability","B","Super-fluxed sinter improves reducibility, reduces raw flux charging and lowers blast furnace coke consumption. "
Q0158,"Which environmental hazard is mainly associated with handling fine raw materials in the sinter plant?","Thermal radiation","Dust pollution","Water pollution","Radiation exposure","B","The extensive use of fine particles generates dust, making ventilation and dust masks essential. "
Q0159,"Which personal protective equipment is specifically recommended in high-noise areas of the sinter plant?","Respirator","Ear Plug","Face Shield","Apron","B","Ear plugs are mandatory in areas such as exhausters, compressors and crushers due to high noise levels. "
Q0160,"According to the chapter, a fully implemented ISO 45001:2018 Occupational Health and Safety Management System ultimately aims to:","Increase production regardless of safety","Systematically reduce workplace risks, accidents and legal non-compliance","Improve only product quality","Replace ISO 9001","B","ISO 45001 focuses on identifying hazards controlling occupational risks reducing accidents and ensuring legal compliance. This is one of the most important theory questions from the chapter.
