question_id,question,option_a,option_b,option_c,option_d,correct_answer,explanation
Q0001,"What is the primary purpose of the sintering process in an integrated steel plant?","To increase iron ore grade","To agglomerate iron ore fines and metallurgical wastes into a porous blast furnace burden","To reduce coke consumption by direct reduction","To produce pig iron directly","B","Sintering agglomerates iron ore fines and metallurgical wastes by incipient fusion, producing a strong, porous material suitable for blast furnace charging. The other options do not describe the primary purpose. "
Q0002,"Sintering is best defined as the process of:","Melting iron ore completely","Agglomerating fines by incipient fusion using heat from fuel present in the charge","Reducing iron ore by hydrogen","Pelletizing ore without heating","B","Sintering occurs through incipient fusion caused by heat generated from the fuel within the charge. It is not complete melting or reduction. "
Q0003,"Which of the following is NOT a standard raw material used in a sinter plant?","Iron ore fines","Coke breeze fines","BOF Sludge","Lump iron ore","D","Sinter plants are designed to utilize fine materials and wastes. Lump iron ore is directly suitable for blast furnace charging and is not a normal sinter mix constituent. "
Q0004,"What is the primary purpose of the balling drum in the sintering process?","Cooling the sinter cake","Crushing return fines","Mixing base mix with water to form green mix nodules","Screening finished sinter","C","The balling drum mixes raw materials with water and forms nodules (green mix), improving bed permeability and sintering efficiency. "
Q0005,"Why is a hearth layer of 10–20 mm sinter provided on the pallet before charging the green mix?","To increase coke consumption","To protect the pallet and maintain proper air flow during sintering","To cool the charge","To increase moisture content","B","The hearth layer protects the pallet and ensures uniform suction and gas flow, leading to proper sintering. "
Q0006,"Which gas is mainly used for igniting the top layer of the green mix in the ignition furnace according to the chapter?","Nitrogen","Carbon monoxide-rich gaseous fuel","Oxygen","Steam","B","The top layer is ignited in the ignition furnace using gaseous fuel, mainly CO-rich gas as described in the process. "
Q0007,"What is the function of exhausters (waste gas fans) in the sintering process?","Supply cooling water","Draw air downward through the sinter bed to sustain combustion","Transport sinter to the blast furnace","Feed coke breeze","B","Exhausters create under-grate suction, allowing the combustion zone to travel downward through the bed. "
Q0008,"The ideal size of sinter charged to the blast furnace is:","0–5 mm","5–40 mm","40–80 mm","80–120 mm","B","Blast furnace requires sinter in the size range of 5–40 mm. Material below 5 mm is recycled as return fines. "
Q0009,"What happens to sinter particles smaller than 5 mm after screening?","Sent to steel melting shop","Discarded as waste","Returned to the sinter bins as return fines","Mixed with coke oven coal","C","−5 mm sinter is recycled back to the process as return fines, improving material utilization. "
Q0010,"Which gaseous fuels are commonly used in the ignition furnace?","LPG only","Natural gas only","Coke oven gas or mixed gas (COG + BF gas)","Producer gas only","C","The ignition furnace mainly uses coke oven gas or mixed gas consisting of coke oven gas and blast furnace gas. "
Q0011,"Which zone of sintering attains the highest temperature (about 1300–1350°C)?","Cold sinter zone","Heating zone","Zone of intensive combustion of fuel","Re-condensation zone","C","Maximum temperature develops in the combustion zone where both thermal and chemical reactions occur. "
Q0012,"How many distinct zones are present in the sintering process after ignition?","Four","Five","Six","Seven","C","The chapter clearly divides the process into six distinct thermal zones. "
Q0013,"In which zone do both thermal and chemical reactions occur?","Cold sinter zone","Hot sinter zone","Zone of intensive combustion of fuel","Pre-heating zone","C","Only the combustion zone involves simultaneous thermal and chemical reactions; all other zones are mainly thermal. "
Q0014,"Disappearance of the combustion zone indicates:","Beginning of ignition","Maximum productivity","Completion of the sintering process","Need for additional moisture","C","When the combustion zone reaches the bottom and disappears, sintering is complete. "
Q0015,"Increase in +10 mm iron ore fines in the base mix primarily results in:","Higher productivity","Weak sinter and lower productivity","Lower coke consumption","Higher DTI","B","Oversized ore particles reduce proper bonding and adversely affect sinter quality and productivity. "
Q0016,"High alumina (Al₂O₃) in iron ore fines mainly causes:","Improved reducibility","Decrease in RDI","Increase in RDI and generation of more −5 mm fines","Higher tumbler index","C","Higher alumina increases Reduction Degradation Index (RDI), producing more fines and chute jamming. "
Q0017,"An increase in silica (SiO₂) in iron ore fines makes sinter:","More ductile","More brittle due to increased glassy phase","More porous","More reducible","B","Higher silica increases the glassy phase, causing brittleness in sinter. "
Q0018,"For efficient sintering, the flux crushing index should be at least:","70%","80%","90%","95%","C","Flux should contain at least 90% of −3 mm particles for proper sintering. "
Q0019,"For efficient sintering, the coke crushing index should be more than:","70%","75%","85%","95%","C","Coke crushing index should exceed 85% to ensure proper combustion and productivity. "
Q0020,"The optimum moisture content of the base mix is approximately:","2–3%","4–5%","7–8%","12–15%","C","About 7–8% moisture provides optimum balling and bed permeability. Too much or too little moisture reduces productivity. "
Q0021,"The recommended ignition furnace temperature is approximately:","800–900°C","950–1050°C","1150–1250°C","1400–1500°C","C","The ignition hearth is maintained between 1150°C and 1250°C for proper ignition. "
Q0022,"Burn Through Point (BTP) indicates:","Completion of crushing","Completion of sintering","Completion of screening","Completion of cooling","B","BTP is the exhaust gas temperature indicating completion of sintering and is about 400°C. "
Q0023,"The approximate Burn Through Point (BTP) temperature is:","200°C","300°C","400°C","600°C","C","The BTP is approximately 400°C and is observed near the second-last wind box. "
Q0024,"After cooling, the normal discharge temperature of sinter from the cooler should be:","20–30°C","40–50°C","60–80°C","120–150°C","C","Finished sinter is cooled to about 60–80°C before screening and dispatch. "
Q0025,"According to blast furnace requirements, the screened sinter should contain at least what percentage of +10 mm fraction?","50%","55%","65%","75%","C","After screening +10 mm fraction should be at least 65% while −5 mm should not exceed 6% ensuring proper blast furnace performance.
Q0026,"Which one of the following is NOT an advantage of using sinter in the blast furnace?","Improved hot metal quality","Better utilization of iron ore fines","Increased coke consumption in blast furnace","Improved blast furnace permeability","C","Use of sinter improves permeability, productivity and hot metal quality while reducing coke consumption. Increased coke consumption is opposite to the actual benefit. "
Q0027,"Increasing the percentage of sinter in the blast furnace burden primarily improves:","Slag viscosity","Burden permeability and furnace productivity","Hot blast temperature","Bell-less top efficiency","B","Higher sinter proportion improves burden permeability, leading to faster reduction, higher productivity and lower coke rate. "
Q0028,"Which quality parameter measures the cold mechanical strength of sinter?","RDI","Basicity","DTI (Tumbler Index)","FeO","C","DTI evaluates the resistance of sinter to impact and abrasion during handling and transportation. "
Q0029,"According to the blast furnace quality requirement, the FeO content of sinter should generally be:","2–4%","5–7%","8–11%","12–15%","C","The specified FeO range is 8.0–11.0%, ensuring suitable sinter quality for blast furnace operation. "
Q0030,"The required MgO content in blast furnace sinter is approximately:","0.5–1.0%","1.5–2.0%","2.6–3.0%","4.5–5.5%","C","MgO should generally be maintained between 2.6% and 3.0%. "
Q0031,"The desired basicity of sinter is approximately:","0.8–1.0","1.2–1.4","1.6–2.1","2.8–3.5","C","The recommended basicity for blast furnace sinter is 1.6–2.1. "
Q0032,"According to the quality specification, the maximum permissible RDI of sinter is:","10%","20%","30%","40%","C","The Reduction Degradation Index should not exceed 30% for good blast furnace performance. "
Q0033,"Which statement regarding RDI (Reduction Degradation Index) is correct?","Higher RDI is always desirable","It measures sinter degradation during low-temperature reduction","It measures hot strength only","It indicates coke quality","B","RDI evaluates the degradation tendency of sinter during low-temperature reduction (about 550°C). Lower RDI values are preferred. "
Q0034,"The RDI test is normally carried out at approximately:","250°C","400°C","550°C","900°C","C","The standard static RDI test is conducted at around 550°C. "
Q0035,"Lower values of RDI indicate:","Poor sinter quality","Higher degradation during reduction","Better resistance to degradation in the blast furnace","Lower productivity","C","A lower RDI means the sinter produces fewer fines during reduction and performs better inside the blast furnace. "
Q0036,"Where is the Burn Through Point (BTP) normally observed in a sinter machine?","At the ignition furnace","At the charging end","At the second-last wind box from the discharge end","Inside the cooler","C","The BTP is observed near the second-last wind box and indicates completion of sintering. "
Q0037,"Which equipment is primarily responsible for pelletizing (nodulizing) the raw mix?","Cooler","Balling drum","Crusher","Wind box","B","The balling drum mixes the base mix with water and forms nodules before charging the sinter machine. "
Q0038,"Which equipment creates the under-grate suction necessary for sintering?","Rod mill","ESP","Exhauster","Hammer crusher","C","The exhauster draws air through the sinter bed, sustaining downward combustion. "
Q0039,"What is the primary function of the Electrostatic Precipitator (ESP) in a sinter plant?","Cool the sinter","Ignite the charge","Clean exhaust gas","Crush return fines","C","The ESP removes dust particles from exhaust gases before they are discharged to the atmosphere. "
Q0040,"Which techno-economic parameter should be maximized for economical sinter production?","Specific heat consumption","Specific coke consumption","Specific productivity","Specific power consumption","C","For economical operation, specific productivity should be as high as possible, while heat, coke, power and flux consumption should be minimized. "
Q0041,"Which of the following techno-economic parameters should be kept as low as possible?","Specific productivity","Specific coke consumption","Yield percentage","Blast furnace volume","B","Lower specific coke consumption directly reduces production cost while maintaining sinter quality. "
Q0042,"Which safety hazard in a sinter plant requires the mandatory use of a CO gas monitor?","Noise pollution","Dust pollution","Gas safety during work on gas lines","Heat stress","C","Mixed gas and coke oven gas contain carbon monoxide; therefore, CO gas monitors are mandatory during gas line work. "
Q0043,"What is the permissible chimney stack emission mentioned in the chapter?","20 mg/Nm³","30 mg/Nm³","50 mg/Nm³","100 mg/Nm³","C","The chapter specifies a chimney stack emission limit of 50 mg/Nm³. "
Q0044,"Which personal protective equipment is essential in high-noise areas such as exhausters and hammer crushers?","Safety goggles","Ear plugs","Respirator","Face shield","B","Ear plugs are essential because these areas generate very high noise levels. "
Q0045,"ISO 45001:2018 primarily deals with:","Quality Management System","Environmental Management System","Occupational Health and Safety Management System","Energy Management System","C","ISO 45001 establishes a formal occupational health and safety management system for identifying hazards and controlling workplace risks. "
Q0046,"ISO 45001:2018 is primarily concerned with:","Safety of the final product","Safety of the end user","Health and safety of people at work","Marketing quality","C","The standard focuses on occupational health and safety of employees rather than product safety. "
Q0047,"ISO 45001 is fully compatible with which two management system standards?","ISO 22000 and ISO 50001","ISO 9001 and ISO 14001","ISO 17025 and ISO 27001","ISO 31000 and ISO 26000","B","ISO 45001 integrates effectively with ISO 9001 (Quality) and ISO 14001 (Environment). "
Q0048,"Which of the following is NOT listed as an impact of a fully implemented OH&SMS?","Reduced accidents","Reliable operations","Increased workplace hazards","Positive company image","C","A properly implemented Occupational Health and Safety Management System reduces risks and improves operational reliability and reputation. "
Q0049,"Which quality parameter is directly related to the tendency of sinter to generate fines during transportation?","Basicity","DTI (Tumbler Index)","MgO","Available Lime","B","DTI measures the cold strength of sinter and its resistance to degradation during handling and transportation. "
Q0050,"A higher machine speed during sintering generally results in:","Complete sintering and higher productivity","Lower Burn Through Point and increased generation of −5 mm fines","Higher DTI","Lower coke consumption only","B","Excessive machine speed prevents complete sintering, lowers BTP and increases return fines reducing overall productivity.
Q0051,"Which raw material acts as the solid fuel in the sintering process?","Iron ore fines","Limestone fines","Coke breeze","Mill scale","C","Coke breeze provides the heat required for incipient fusion during sintering and is the principal solid fuel in the sinter mix. "
Q0052,"The downward movement of the combustion zone through the sinter bed is mainly due to:","Water spraying","Natural convection","Under-grate suction created by exhausters","Mechanical vibration","C","The exhausters draw air downward through the bed, causing the combustion front to move progressively downward. "
Q0053,"Which of the following best describes 'Green Mix'?","Finished sinter after cooling","Base mix after addition of water and nodulization","Crushed return fines","Screened blast furnace burden","B","After adding water and forming nodules in the balling drum, the base mix becomes the green mix ready for charging. "
Q0054,"Which statement regarding moisture addition is correct?","Higher moisture always improves productivity","Lower moisture always improves balling","Both excess and insufficient moisture reduce bed permeability and productivity","Moisture has no effect on sintering","C","The optimum moisture is around 7–8%; both excess and deficiency adversely affect permeability and productivity. "
Q0055,"Very high ignition hearth temperature mainly causes:","Improved permeability","Fusion of the top layer, reducing bed permeability","Lower coke consumption only","Increase in DTI only","B","Excessively high ignition temperature fuses the top layer, restricting airflow and lowering productivity. "
Q0056,"Low ignition furnace temperature primarily results in:","Improper ignition and increase in −5 mm return fines","Increase in permeability","Higher sintering speed","Improved sinter strength","A","Insufficient ignition causes incomplete sintering, producing more return fines and lowering productivity. "
Q0057,"Increasing the coke rate beyond the recommended value mainly leads to:","Better permeability","Fusion of the top layer and sticker formation","Lower fuel consumption","Reduction in return fines","B","Excess coke causes excessive heat, top-layer fusion and sticker formation, reducing bed permeability. "
Q0058,"A coke rate lower than the recommended value causes:","Complete sintering","Improved productivity","Incomplete sintering","Higher tumbler index","C","Insufficient coke fails to generate enough heat, leading to incomplete sintering. "
Q0059,"During cooling of crushed sinter, for effective cooling the larger particles should be placed:","At the top","Randomly","At the bottom","Only at the sides","C","Larger sinter pieces are kept at the bottom and smaller pieces at the top to achieve efficient air distribution and cooling. "
Q0060,"Which size fraction is separated and reused specifically as the hearth layer?","−5 mm","5–10 mm","15–20 mm","40–60 mm","C","The 15–20 mm fraction is screened separately and reused as the hearth layer for the sinter machine. "
Q0061,"The primary purpose of adding metallurgical wastes such as mill scale, BOF sludge and LD slag to the sinter mix is to:","Increase moisture","Economically recycle valuable iron-bearing wastes","Reduce ignition temperature","Replace coke completely","B","Sintering enables economical utilization of iron-bearing metallurgical wastes that would otherwise be difficult to dispose of. "
Q0062,"Which parameter is mainly used to predict sinter degradation behaviour inside the lower part of the blast furnace?","Basicity","DTI","RDI","Mean size","C","RDI predicts the degradation behaviour of sinter during reduction in the lower stack of the blast furnace. "
Q0063,"The coke crushing index is defined as the percentage of which size fraction in a coke sample?","+5 mm","−3 mm","−1 mm","10–20 mm","B","Coke crushing index is the percentage of −3 mm particles present in the coke sample. "
Q0064,"The flux crushing index is defined as the percentage of which size fraction in a flux sample?","+5 mm","−1 mm","−3 mm","5–10 mm","C","Flux crushing index is based on the percentage of −3 mm particles and should exceed 90% for efficient sintering. "
Q0065,"Which equipment is primarily responsible for adjusting the feeding rate of raw materials from the proportioning bins?","Rod mills","Electronic feeders","Coolers","Battery cyclones","B","Electronic feeders accurately control the proportioning of raw materials entering the process. "
Q0066,"Which equipment cools and normalizes the finished sinter?","Crusher","Cooler","Balling drum","ESP","B","The cooler lowers the sinter temperature and normalizes it before screening and dispatch. "
Q0067,"Which equipment is mainly used for cleaning exhaust air before its release to the atmosphere?","Sinter pallets","Battery cyclones and ESP","Balling drum","Wind box","B","Battery cyclones and ESP remove dust from the exhaust gas, minimizing emissions. "
Q0068,"Specific heat consumption in a sinter plant is defined as:","Power consumed per tonne of sinter","Gas consumed per tonne of sinter","Coke consumed per tonne of sinter","Flux consumed per tonne of sinter","B","Specific heat consumption refers to the quantity of gaseous fuel consumed per tonne of sinter produced. "
Q0069,"Specific productivity is expressed as:","Tonnes of coke per hour","Tonnes of sinter per square metre per hour","Tonnes of iron ore per day","Tonnes of slag per shift","B","Specific productivity is the amount of sinter produced per square metre of machine area per hour. "
Q0070,"Which statement best explains why super-fluxed sinter improves blast furnace performance?","It increases slag volume","It eliminates raw flux addition, improves reducibility and lowers coke consumption","It completely replaces coke","It reduces iron content of burden","B","Super-fluxed sinter improves reducibility, eliminates raw flux charging reduces coke rate and enhances blast furnace productivity.
Q0071,"Which one of the following reactions is primarily responsible for heat generation during sintering?","CaCO₃ → CaO + CO₂","MgCO₃ → MgO + CO₂","C + O₂ → CO₂ + Heat","CO₂ + C → 2CO","C","The combustion of coke (C + O₂ → CO₂) is the principal exothermic reaction supplying heat for the sintering process. The decomposition reactions consume heat rather than generate it. "
Q0072,"Which decomposition reaction takes place during sintering?","Fe₂O₃ → Fe","CaCO₃ → CaO + CO₂","CO₂ + C → CO","FeO → Fe","B","Limestone (CaCO₃) decomposes into CaO and CO₂ at high temperature, providing lime for bonding and basicity. "
Q0073,"The principal reducing gas formed during the sintering process is:","Nitrogen","Hydrogen","Carbon monoxide (CO)","Oxygen","C","Carbon monoxide is generated during coke combustion and participates in the reduction reactions occurring in the sinter bed. "
Q0074,"The maximum temperature attained in the combustion zone during sintering is approximately:","900–1000°C","1000–1100°C","1300–1350°C","1500–1600°C","C","The combustion zone reaches approximately 1300–1350°C, where bonding and sinter formation occur. "
Q0075,"Which zone is immediately above the combustion zone during normal sintering?","Cold sinter zone","Hot sinter zone (ready sinter)","Moisture re-condensation zone","Pre-heating zone","B","The hot sinter (ready sinter) zone lies above the combustion zone and transfers heat to the incoming air. "
Q0076,"The vertical movement of the thermal zones mainly depends upon:","Machine width","Coke size","Vertical speed of sintering","Amount of return fines","C","The chapter states that the movement of thermal zones is governed by the vertical speed of the sintering process. "
Q0077,"In the pre-heating zone, the charge is mainly heated by:","Electric heaters","Heat transferred from the combustion products","Direct flame from ignition furnace","Steam injection","B","The charge is heated by hot gases drawn through the bed from the combustion zone. "
Q0078,"The moisture re-condensation zone is characterized by:","Highest temperature","Transfer of excess moisture from exhaust gases to the charge","Complete combustion of coke","Rapid cooling by water spray","B","In this zone, moisture from exhaust gases condenses on the cooler charge before finally evaporating. "
Q0079,"The completion of burning of coke fines in the bottom layer signifies:","Beginning of ignition","Completion of the sintering process","Start of cooling","Beginning of screening","B","Once the combustion front reaches the bottom layer and coke combustion is complete, the sintering process ends. "
Q0080,"Approximately how much coke is required to produce one tonne of sinter (wet basis)?","20–30 kg","40–50 kg","65–70 kg","100–120 kg","C","The approximate charge proportion specifies 65–70 kg of coke per tonne of sinter (wet basis). "
Q0081,"Approximately how much iron ore fines are required to produce one tonne of sinter (wet basis)?","500–600 kg","600–700 kg","750–825 kg","900–1000 kg","C","Iron ore fines constitute the major portion of the sinter mix, typically 750–825 kg per tonne of sinter. "
Q0082,"Approximately how much limestone is used per tonne of sinter (wet basis)?","50–80 kg","100–120 kg","150–180 kg","250–300 kg","C","The standard charge proportion lists limestone at 150–180 kg per tonne of sinter. "
Q0083,"According to the recommended iron ore quality, the +10 mm fraction should be:","Less than 5%","Less than 10%","Nil","More than 20%","C","Oversized ore particles adversely affect sinter quality; therefore, the +10 mm fraction should ideally be nil. "
Q0084,"The recommended maximum percentage of −1 mm iron ore fines is:","10%","20%","30%","40%","C","The chapter recommends that the −1 mm fraction should not exceed 30% for proper bed permeability. "
Q0085,"The maximum recommended alumina (Al₂O₃) content in iron ore fines is:","1.5%","2.0%","2.55%","4.0%","C","The recommended maximum alumina content is 2.55%; higher values increase RDI and generate more fines. "
Q0086,"The maximum recommended silica (SiO₂) content in iron ore fines is:","1.5%","2.0%","2.91%","4.8%","C","Silica should be limited to about 2.91% in iron ore fines to avoid excessive glassy phase formation. "
Q0087,"An increase in −1 mm iron ore fines mainly causes:","Higher permeability","Lower permeability and reduced productivity","Improved sinter strength","Lower RDI","B","Excessive fine particles reduce bed permeability, slowing the sintering process and lowering productivity. "
Q0088,"The minimum recommended percentage of −3 mm flux particles (flux crushing index) is:","75%","80%","90%","95%","C","Efficient sintering requires a flux crushing index of at least 90%. "
Q0089,"The maximum permissible +5 mm fraction in coke should be:","5%","2%","Nil","10%","C","The presence of oversized coke particles decreases productivity; therefore, the +5 mm fraction should ideally be nil. "
Q0090,"An increase in coke particles smaller than 0.5 mm mainly results in:","Reduced coke consumption","Higher coke consumption during sintering","Higher machine speed","Lower ignition temperature","B","Very fine coke burns rapidly and inefficiently, increasing overall coke consumption during sintering.
Q0091,"The optimum water addition to the base mix for proper balling and permeability is approximately:","3–4%","5–6%","7–8%","10–12%","C","About 7–8% moisture is considered optimum. Both higher and lower moisture reduce bed permeability and productivity. "
Q0092,"The ignition hearth temperature is maintained at 1150–1250°C mainly to:","Dry the raw materials","Ignite the top layer of the green mix","Cool the sinter bed","Reduce return fines directly","B","The ignition furnace provides sufficient heat to ignite the top layer, initiating downward combustion. "
